{
  "catalogVersion": "2026.08.2",
  "schemaVersion": 1,
  "stations": [
    {
      "aliases": [],
      "countryCode": "US",
      "faviconUrl": null,
      "homepageUrl": null,
      "id": "somafm-metal-detector",
      "language": null,
      "legacyIds": [
        "rockmobile:rockcast-89af54cf1a2e84d4"
      ],
      "name": "SomaFM — Metal Detector",
      "streams": [
        {
          "bitrateKbps": 128,
          "codec": "mp3",
          "id": "main",
          "primary": true,
          "url": "https://ice6.somafm.com/metal-128-mp3"
        }
      ],
      "tags": [
        "heavy metal",
        "metal"
      ]
    },
    {
      "aliases": [],
      "countryCode": "DE",
      "faviconUrl": null,
      "homepageUrl": null,
      "id": "rock-antenne-heavy-metal",
      "language": null,
      "legacyIds": [
        "rockmobile:rockcast-660f61c42c941373"
      ],
      "name": "Rock Antenne — Heavy Metal",
      "streams": [
        {
          "bitrateKbps": 128,
          "codec": "mp3",
          "id": "main",
          "primary": true,
          "url": "https://stream.rockantenne.de/heavy-metal/stream/mp3"
        }
      ],
      "tags": [
        "heavy metal",
        "metal"
      ]
    },
    {
      "aliases": [],
      "countryCode": "RU",
      "faviconUrl": null,
      "homepageUrl": null,
      "id": "radio-caprice-heavy-metal",
      "language": null,
      "legacyIds": [
        "rockmobile:rockcast-4050f61ecbbb1558"
      ],
      "name": "Radio Caprice — Heavy Metal",
      "streams": [
        {
          "bitrateKbps": 128,
          "codec": "aac",
          "id": "main",
          "primary": true,
          "url": "http://79.111.14.76:8002/heavymetal"
        }
      ],
      "tags": [
        "heavy metal",
        "metal"
      ]
    },
    {
      "aliases": [],
      "countryCode": "RU",
      "faviconUrl": null,
      "homepageUrl": null,
      "id": "radio-caprice-nu-metal",
      "language": null,
      "legacyIds": [
        "rockmobile:rockcast-00868ea7591717e0"
      ],
      "name": "Radio Caprice — Nu Metal",
      "streams": [
        {
          "bitrateKbps": 128,
          "codec": "aac",
          "id": "main",
          "primary": true,
          "url": "http://79.111.14.76:8002/numetal"
        }
      ],
      "tags": [
        "metal",
        "nu metal"
      ]
    },
    {
      "aliases": [],
      "countryCode": "RU",
      "faviconUrl": null,
      "homepageUrl": null,
      "id": "radio-caprice-industrial",
      "language": null,
      "legacyIds": [
        "rockmobile:rockcast-c1a2ad5b9f4ed60c"
      ],
      "name": "Radio Caprice — Industrial",
      "streams": [
        {
          "bitrateKbps": 128,
          "codec": "aac",
          "id": "main",
          "primary": true,
          "url": "http://79.111.14.76:8002/industrial"
        }
      ],
      "tags": [
        "industrial",
        "metal"
      ]
    },
    {
      "aliases": [],
      "countryCode": "US",
      "faviconUrl": null,
      "homepageUrl": null,
      "id": "gotradio-metal-madness",
      "language": null,
      "legacyIds": [
        "rockmobile:rockcast-455782bf21330fa6"
      ],
      "name": "GotRadio — Metal Madness",
      "streams": [
        {
          "bitrateKbps": 128,
          "codec": "mp3",
          "id": "main",
          "primary": true,
          "url": "http://pureplay.cdnstream1.com/6016_128.mp3"
        }
      ],
      "tags": [
        "metal"
      ]
    },
    {
      "aliases": [],
      "countryCode": "US",
      "faviconUrl": null,
      "homepageUrl": null,
      "id": "gotradio-metal-frontier",
      "language": null,
      "legacyIds": [
        "rockmobile:rockcast-94e353bf74b7c923"
      ],
      "name": "GotRadio — Metal Frontier",
      "streams": [
        {
          "bitrateKbps": 128,
          "codec": "mp3",
          "id": "main",
          "primary": true,
          "url": "http://pureplay.cdnstream1.com/6022_128.mp3"
        }
      ],
      "tags": [
        "metal"
      ]
    },
    {
      "aliases": [],
      "countryCode": "CA",
      "faviconUrl": null,
      "homepageUrl": null,
      "id": "metal-rock-radio",
      "language": null,
      "legacyIds": [
        "rockmobile:rockcast-d89b07dce3283690"
      ],
      "name": "Metal Rock Radio",
      "streams": [
        {
          "bitrateKbps": 128,
          "codec": "mp3",
          "id": "main",
          "primary": true,
          "url": "https://kathy.torontocast.com:2800/stream"
        }
      ],
      "tags": [
        "hard rock",
        "metal"
      ]
    },
    {
      "aliases": [],
      "countryCode": "CH",
      "faviconUrl": null,
      "homepageUrl": null,
      "id": "1-fm-high-voltage",
      "language": null,
      "legacyIds": [
        "rockmobile:rockcast-235c957b2de5b4ac"
      ],
      "name": "1.FM — High Voltage",
      "streams": [
        {
          "bitrateKbps": 128,
          "codec": "mp3",
          "id": "main",
          "primary": true,
          "url": "http://strm112.1.fm/highvoltage_mobile_mp3"
        }
      ],
      "tags": [
        "hard rock",
        "metal"
      ]
    },
    {
      "aliases": [],
      "countryCode": "US",
      "faviconUrl": null,
      "homepageUrl": null,
      "id": "181-fm-hair-band",
      "language": null,
      "legacyIds": [
        "rockmobile:rockcast-18fd84500325144b"
      ],
      "name": "181.FM — Hair Band",
      "streams": [
        {
          "bitrateKbps": 128,
          "codec": "mp3",
          "id": "main",
          "primary": true,
          "url": "https://listen.181fm.com/181-hairband_128k.mp3"
        }
      ],
      "tags": [
        "hair metal",
        "hard rock"
      ]
    },
    {
      "aliases": [],
      "countryCode": "DE",
      "faviconUrl": null,
      "homepageUrl": null,
      "id": "rock-antenne",
      "language": null,
      "legacyIds": [
        "rockmobile:rockcast-d69fa8ad3a26c125"
      ],
      "name": "Rock Antenne",
      "streams": [
        {
          "bitrateKbps": 128,
          "codec": "mp3",
          "id": "main",
          "primary": true,
          "url": "https://stream.rockantenne.de/rockantenne/stream/mp3"
        }
      ],
      "tags": [
        "hard rock",
        "rock"
      ]
    },
    {
      "aliases": [],
      "countryCode": "DE",
      "faviconUrl": null,
      "homepageUrl": null,
      "id": "rock-antenne-classic-perlen",
      "language": null,
      "legacyIds": [
        "rockmobile:rockcast-c16b2935b0241a1f"
      ],
      "name": "Rock Antenne — Classic Perlen",
      "streams": [
        {
          "bitrateKbps": 128,
          "codec": "mp3",
          "id": "main",
          "primary": true,
          "url": "https://stream.rockantenne.de/classic-perlen/stream/mp3"
        }
      ],
      "tags": [
        "classic rock"
      ]
    },
    {
      "aliases": [],
      "countryCode": "DE",
      "faviconUrl": null,
      "homepageUrl": null,
      "id": "rock-antenne-soft-rock",
      "language": null,
      "legacyIds": [
        "rockmobile:rockcast-38cdec5ff92c4389"
      ],
      "name": "Rock Antenne — Soft Rock",
      "streams": [
        {
          "bitrateKbps": 128,
          "codec": "mp3",
          "id": "main",
          "primary": true,
          "url": "https://stream.rockantenne.de/soft-rock/stream/mp3"
        }
      ],
      "tags": [
        "rock",
        "soft rock"
      ]
    },
    {
      "aliases": [],
      "countryCode": "DE",
      "faviconUrl": null,
      "homepageUrl": null,
      "id": "rock-antenne-80er-rock",
      "language": null,
      "legacyIds": [
        "rockmobile:rockcast-841adb39a76ec9bc"
      ],
      "name": "Rock Antenne — 80er Rock",
      "streams": [
        {
          "bitrateKbps": 128,
          "codec": "mp3",
          "id": "main",
          "primary": true,
          "url": "https://stream.rockantenne.de/80er-rock/stream/mp3"
        }
      ],
      "tags": [
        "80s",
        "rock"
      ]
    },
    {
      "aliases": [],
      "countryCode": "DE",
      "faviconUrl": null,
      "homepageUrl": null,
      "id": "rock-antenne-modern-rock",
      "language": null,
      "legacyIds": [
        "rockmobile:rockcast-3387327b7305179b"
      ],
      "name": "Rock Antenne — Modern Rock",
      "streams": [
        {
          "bitrateKbps": 128,
          "codec": "mp3",
          "id": "main",
          "primary": true,
          "url": "https://stream.rockantenne.de/modern-rock/stream/mp3"
        }
      ],
      "tags": [
        "modern rock",
        "rock"
      ]
    },
    {
      "aliases": [],
      "countryCode": "DE",
      "faviconUrl": null,
      "homepageUrl": null,
      "id": "rock-antenne-deutschrock",
      "language": null,
      "legacyIds": [
        "rockmobile:rockcast-8022c1d5cdc58cf9"
      ],
      "name": "Rock Antenne — Deutschrock",
      "streams": [
        {
          "bitrateKbps": 128,
          "codec": "mp3",
          "id": "main",
          "primary": true,
          "url": "https://stream.rockantenne.de/deutschrock/stream/mp3"
        }
      ],
      "tags": [
        "deutschrock",
        "rock"
      ]
    },
    {
      "aliases": [],
      "countryCode": "DE",
      "faviconUrl": null,
      "homepageUrl": null,
      "id": "rock-antenne-symphonic",
      "language": null,
      "legacyIds": [
        "rockmobile:rockcast-01f0963667a438a5"
      ],
      "name": "Rock Antenne — Symphonic",
      "streams": [
        {
          "bitrateKbps": 128,
          "codec": "mp3",
          "id": "main",
          "primary": true,
          "url": "https://stream.rockantenne.de/symphonic-rock/stream/mp3"
        }
      ],
      "tags": [
        "symphonic rock"
      ]
    },
    {
      "aliases": [],
      "countryCode": "DE",
      "faviconUrl": null,
      "homepageUrl": null,
      "id": "hit-radio-ffh-rock",
      "language": null,
      "legacyIds": [